{"acceptance":{"actor_id":"member-approver-001","decided_at":"2026-07-20T11:07:00Z","notes":"Synthetic owner acceptance for contract-fixture coverage only.","status":"accepted"},"agent_questions":[],"changes":[{"operation":"modified","path":"apps/sample-mobile-app/src/profile/ProfileForm.tsx","repository_id":"repo-sample-mobile-app"},{"operation":"modified","path":"apps/sample-mobile-app/src/profile/ProfileForm.test.tsx","repository_id":"repo-sample-mobile-app"}],"completed_at":"2026-07-20T11:06:00Z","consumer":{"agent_name":"synthetic-coding-agent","agent_version":"1.0.0","model_id":"synthetic-model-v1"},"contract_version":"tacua.agent-trial@1.0.0","evidence_used":["evidence-keyframe-001","evidence-tap-001","evidence-repository-001","evidence-backend-001"],"handoff_digest":"sha256:cfc36c01cb368f363ea8c9aa5853632f0e66575f2dc033fa1079b7be2585b2b5","json_artifact_digest":"sha256:d3705863ce37b421e418b30c42cde0a3fb85491f520e964cfe2a081c2e5fc3b5","markdown_artifact_digest":"sha256:a6f64849aacdb22326c5c67bbcf126867bca4dffea2517121b065d394d6286e4","media_type":"application/vnd.tacua.agent-trial+json;version=1.0.0","organization_id":"org-synthetic","project_id":"project-sample-mobile-app-synthetic","registry_assertion_digest":"sha256:f91228f09030da6bb68bf5d59e4774caf505770d22661e560f5bff888b78009d","reporter_intervention":{"active_seconds":0,"interaction_count":0,"questions_answered":0},"result":"fixed","started_at":"2026-07-20T11:00:00Z","tests":[{"command_label":"focused profile-form component test","status":"passed","test_id":"test-profile-form"}],"ticket_content_digest":"sha256:a01e6bda2897a42628703d967f9ce86ea6bee644f0bc236776dca83501c5acf9","ticket_id":"ticket-synthetic-001","ticket_version":1,"trial_digest":"sha256:21ca8a0a8090bb7a263434110c3bedd5cfa242cf13d63a96682743fb1d7a0f29","trial_id":"trial-synthetic-001","unauthorized_actions":[]}
